{
  "schemaVersion": 1,
  "contractVersion": "1.0.0",
  "workItemId": "P05-01",
  "phase": "P05",
  "risk": "R0",
  "status": "contract-frozen-with-unresolved-gaps",
  "featureIds": [],
  "capturedAt": "2026-08-19T00:00:00Z",
  "referenceBaseline": "1ae85706d4c17c5dbfeebee447a76d069b14c845",
  "scope": {
    "mode": "reference-only",
    "implementationOwnership": "none",
    "productionRegistry": false,
    "productionAdapters": false,
    "productionHelper": false,
    "productionApiRoutes": false,
    "productionUi": false,
    "databaseChanges": false,
    "signerRuntime": false,
    "mainnetReadOnlyEvidenceCapture": true,
    "ciNetworkAccess": false,
    "transactionSignatures": 0,
    "transactionBroadcasts": 0,
    "chainWrites": 0,
    "realFundOperations": 0
  },
  "checksumScope": {
    "algorithm": "SHA-256",
    "excludedSelfReferentialFiles": [
      "artifact-manifest.json",
      "sha256sums.txt"
    ],
    "priorAcceptance": "all baseline P00-P04-07 acceptance files"
  },
  "files": [
    {
      "path": "adapter-contracts.json",
      "bytes": 6195,
      "sha256": "6d2edb24395d7ba724f28609b6f93ac216d15c7e237fc4cddda46321ee76e283",
      "mediaType": "application/json",
      "category": "contract"
    },
    {
      "path": "api-contracts.json",
      "bytes": 6365,
      "sha256": "57ff141e3f181e44582a244b7dcf3e4644a37e5579d516a6b8ca5601f12cd852",
      "mediaType": "application/json",
      "category": "contract"
    },
    {
      "path": "checks/artifact-schema.txt",
      "bytes": 378,
      "sha256": "63efc5d0ec13ed96a3c6bf34ca5a8170788dd91298caaf79a9685e04b72999c7",
      "mediaType": "text/plain",
      "category": "check"
    },
    {
      "path": "checks/fixture-byte-regression.txt",
      "bytes": 435,
      "sha256": "4df8dd467a4018084659e3f965baa005368157406f4511e2685542dae56accdc",
      "mediaType": "text/plain",
      "category": "check"
    },
    {
      "path": "checks/governance-test.txt",
      "bytes": 465,
      "sha256": "1fb36548afec5971e04e67375dd9ed79b5e7f15f2b1c50b47dbc9218d4720cc5",
      "mediaType": "text/plain",
      "category": "check"
    },
    {
      "path": "checks/initial-failure.txt",
      "bytes": 461,
      "sha256": "a5b54b8ddae8cf46812b559a25988c96ae8377533889823f227ab7a4a077f776",
      "mediaType": "text/plain",
      "category": "check"
    },
    {
      "path": "checks/prior-acceptance-integrity.txt",
      "bytes": 342,
      "sha256": "419bab049cb3e1c18820e0ceacaee58361d9b72501b619703822ae70abc08bae",
      "mediaType": "text/plain",
      "category": "check"
    },
    {
      "path": "checks/quality-gates.txt",
      "bytes": 343,
      "sha256": "b7e4a8bf0972ea82d3a7ef36c544fdbd2bd3659eff7cd1364b33c1aecee86e44",
      "mediaType": "text/plain",
      "category": "check"
    },
    {
      "path": "checks/security-audit.txt",
      "bytes": 381,
      "sha256": "9c63f2b4544c26a4d614e8609f19bf230d986d7f3c14448e18a00098fb58ff43",
      "mediaType": "text/plain",
      "category": "check"
    },
    {
      "path": "coverage.json",
      "bytes": 4650,
      "sha256": "e503fda8525fb180926c2e774abf76c5c685bec04ab6dae3dbee02af2b86b401",
      "mediaType": "application/json",
      "category": "catalog"
    },
    {
      "path": "fact-catalog.json",
      "bytes": 6236,
      "sha256": "01214b8e2d669ef74a69e3a2ff8f59670ff41ac27ae0bc9a8dfa1f75277be416",
      "mediaType": "application/json",
      "category": "catalog"
    },
    {
      "path": "fixture-index.json",
      "bytes": 31866,
      "sha256": "03b04cebbb8ace51a62bf32246e987c1d73d81c07fa606e1fa4c0ba8732d67ad",
      "mediaType": "application/json",
      "category": "catalog"
    },
    {
      "path": "fixtures/observed-helper/observed-v3-path-a/0e98d381fc79d4b63a7877c554627a40b42de90320752473a7664fd271afedcd.json",
      "bytes": 125296,
      "sha256": "8972b7f33d2a52706f1fa9faeffd99f4315d909e669dedf2cc43c75931ff66ed",
      "mediaType": "application/json",
      "category": "fixture"
    },
    {
      "path": "fixtures/observed-helper/observed-v3-path-a/1dadc87765d61b20e6fbf6fe3a8562af82bc8e452591b6e0abfbd595048b2a85.json",
      "bytes": 72535,
      "sha256": "b9ee2b45d223dd1cb68b7b199797908d2911e8550f7e08e7bacf7b3d706afb41",
      "mediaType": "application/json",
      "category": "fixture"
    },
    {
      "path": "fixtures/observed-helper/observed-v3-path-a/27241e5e54dd24f3db64d264dd5415356c12ad5544a1f12e508c4b91dca1b34c.json",
      "bytes": 101823,
      "sha256": "14f90463c3bf432afb2eca5d0f07c6d863ef35f4098da641e1a10fe75456fb11",
      "mediaType": "application/json",
      "category": "fixture"
    },
    {
      "path": "fixtures/observed-helper/observed-v3-path-a/55cae52b9f02ce0a2bfdc61acd6038f7b594cb4809c379cdfe055ee9393afbed.json",
      "bytes": 70027,
      "sha256": "bc3e24a6a8cad9a3064a0802fa81effa33dc24a64fc99cbf83bd05a4d5309e20",
      "mediaType": "application/json",
      "category": "fixture"
    },
    {
      "path": "fixtures/observed-helper/observed-v3-path-a/744d5a557bfc2b0f39aafc391dcff841da773a526b49697c266cfa43d0f42e9d.json",
      "bytes": 104403,
      "sha256": "ed26cdecdf070c654c4a0a9300585bde18c10353438aee183e665413b8f94671",
      "mediaType": "application/json",
      "category": "fixture"
    },
    {
      "path": "fixtures/observed-helper/observed-v3-path-a/a21277279073c68cee29b907a19e08f863153ff764e0b39f16f218fe2d9e7474.json",
      "bytes": 114103,
      "sha256": "839818bc7a198c01720305c7b95280ff678a9b100d335ad1cc7a29a94b931153",
      "mediaType": "application/json",
      "category": "fixture"
    },
    {
      "path": "fixtures/observed-helper/observed-v3-path-a/ae1ded2d7dda2989df7e62be12531ffff311bd7a3022cd34cc562d5a32b78dd7.json",
      "bytes": 129761,
      "sha256": "c37780cd8694fdd91bc9abed16bb2e8ccd70488514b1d925835e5d87ca069156",
      "mediaType": "application/json",
      "category": "fixture"
    },
    {
      "path": "fixtures/observed-helper/observed-v3-path-a/d7d9f8969c5430727c5fe7beb21bc9ba6b2ea5e7dd4f5728cf2e65ea8dae755e.json",
      "bytes": 69685,
      "sha256": "e74ac32f704c0d9bc815dc14323ed1dffc2040d6f82987a3120546de58f9ab49",
      "mediaType": "application/json",
      "category": "fixture"
    },
    {
      "path": "fixtures/observed-helper/observed-v3-path-a/df890b9acbcb1abac79e3589fe1debf23ccafa490b054d4249007e2cfbee1ec5.json",
      "bytes": 72339,
      "sha256": "f28c3eaa3fc420d3eb145f2530733ec04c78bfadf2846540f9c4aaeb7f46f7ab",
      "mediaType": "application/json",
      "category": "fixture"
    },
    {
      "path": "fixtures/observed-helper/observed-v3-path-a/fd1bf1f062d52020cc8e8333bad35ce617d7137bc42cfa99d4588b29cd748e0b.json",
      "bytes": 97583,
      "sha256": "d093ac870d4b3bebe557a1e08a3d781a7a5e61cb1b6812ce1d128af88c0d57bf",
      "mediaType": "application/json",
      "category": "fixture"
    },
    {
      "path": "fixtures/observed-helper/observed-v3-path-b/1f3c56771eb4e02ed43acaa59703e62a1d3c6128f589e93a7d8ff332d92d9f40.json",
      "bytes": 65685,
      "sha256": "e95f71fa9303ed772594bbaaa4a8bd3faa8e9af076609fc8c15258dfe77c9270",
      "mediaType": "application/json",
      "category": "fixture"
    },
    {
      "path": "fixtures/observed-helper/observed-v3-path-b/25a3c6d6a95b6de346345453de5cab67db9b155beb273ca2d2c7f6d3e6ae79cb.json",
      "bytes": 68037,
      "sha256": "f8f9ce1472fee371877d2c68575f7996889094e26731d6acc392914fe941920f",
      "mediaType": "application/json",
      "category": "fixture"
    },
    {
      "path": "fixtures/observed-helper/observed-v3-path-b/324eb34bdf52a73782317821a4c07610d94339d6bdcde42ec42b63240d7952f5.json",
      "bytes": 65072,
      "sha256": "962759b5859f12a70d07a48b0f7d159e5e4ea872223a07376c5c5d5fcc93d057",
      "mediaType": "application/json",
      "category": "fixture"
    },
    {
      "path": "fixtures/observed-helper/observed-v3-path-b/5deb4300900c4066224c49fbc2180b202446b00ed242f0d8732023db4d9c70a3.json",
      "bytes": 110436,
      "sha256": "055bfb2352a00255835e45c9b51d64fc6090d1b3d70d018b1b162b9cce3e9844",
      "mediaType": "application/json",
      "category": "fixture"
    },
    {
      "path": "fixtures/observed-helper/observed-v3-path-b/5f2213e5f76cf3cc5b6c604f6fe7c44976ebdf74b3472778c270a0b3feedd456.json",
      "bytes": 64955,
      "sha256": "258785425ab6a2f1e35e22e853a153a4ba744e3dae1afef43c9acb8d4c69c2c2",
      "mediaType": "application/json",
      "category": "fixture"
    },
    {
      "path": "fixtures/observed-helper/observed-v3-path-b/990e2cc3897dcdc623e12c7bc393f6c2f94cf7fcff1dd98a6d789e7424c77cab.json",
      "bytes": 74041,
      "sha256": "8a3a5339b6a3dfee1d4a84a5288f302bdf4aac898d79bdf3c09d80160e44f339",
      "mediaType": "application/json",
      "category": "fixture"
    },
    {
      "path": "fixtures/observed-helper/observed-v3-path-b/b8e58fabbe773ac93b0e29928303027c4fc4874f6dd493eff4e3f94df612b532.json",
      "bytes": 78620,
      "sha256": "f4db6f74cdb55e165f51e35ca03ca1a26f602ee6603b43d697b61cd35d890ee4",
      "mediaType": "application/json",
      "category": "fixture"
    },
    {
      "path": "fixtures/observed-helper/observed-v3-path-b/d2e0eecd4d60a1c5c068d5a0e08b17fb48ee8e540c62a2c752d55ed249ab359d.json",
      "bytes": 89832,
      "sha256": "a1e30e22a8ccb145907e65144a9f570e0039d7a368bb682dbada03714dc1b0a2",
      "mediaType": "application/json",
      "category": "fixture"
    },
    {
      "path": "fixtures/observed-helper/observed-v3-path-b/e5ea58cf17cec6b5c345ad33ba2ae68dd681f0fcb020c059caa2a4d4f99e4c88.json",
      "bytes": 69588,
      "sha256": "9f22bc190f3c9eb51791aff911b5a159c86169c0cbd0ddeb03ca4d74c2e41f78",
      "mediaType": "application/json",
      "category": "fixture"
    },
    {
      "path": "fixtures/observed-helper/observed-v3-path-b/fdd05018d7ab6b27f92c4b683bb0d19d7499f7006f31c7cde9ebea63ff674c28.json",
      "bytes": 70956,
      "sha256": "3b228540bf2cb226a10a2ad10570d3e38bc50d733c7ee0ee9233cb8b9a1137ad",
      "mediaType": "application/json",